{
  "$schema": "https://json-schema.org/draft/2020-12/schema",
  "$id": "https://github.com/repo-doctor/schemas/profile.v1.schema.json",
  "title": "repo-doctor profile (schema version 1)",
  "description": "A shareable policy file. Data only: it cannot define executable code, shell commands, analyzer package URLs, custom assembly paths, or dynamic expressions. This schema documents the contract; the engine enforces it with a strict parser (unknown properties and duplicate keys are errors).",
  "type": "object",
  "additionalProperties": false,
  "required": ["schemaVersion", "id", "version", "title", "engineMajor", "rules", "gate"],
  "properties": {
    "schemaVersion": { "const": 1 },
    "id": {
      "type": "string",
      "pattern": "^[a-z0-9][a-z0-9._-]*/[a-z0-9][a-z0-9._-]*$",
      "description": "namespace/name, e.g. bootstrap/server-core"
    },
    "version": {
      "type": "string",
      "pattern": "^(0|[1-9]\\d*)\\.(0|[1-9]\\d*)\\.(0|[1-9]\\d*)(?:-[0-9A-Za-z-]+(?:\\.[0-9A-Za-z-]+)*)?(?:\\+[0-9A-Za-z-]+(?:\\.[0-9A-Za-z-]+)*)?$",
      "description": "Semantic version. Every published (id, version) is immutable by convention but never trusted without its content hash."
    },
    "title": { "type": "string", "minLength": 1 },
    "description": { "type": "string" },
    "targetContext": { "type": "string" },
    "authors": { "type": "array", "items": { "type": "string" } },
    "derivedFrom": {
      "type": "array",
      "description": "Attribution only. Parent profiles are not loaded or resolved.",
      "items": {
        "type": "object",
        "additionalProperties": false,
        "required": ["id", "version", "sha256"],
        "properties": {
          "id": { "type": "string", "minLength": 1 },
          "version": { "type": "string", "minLength": 1 },
          "sha256": { "type": "string", "pattern": "^[0-9a-f]{64}$" }
        }
      }
    },
    "engineMajor": { "type": "integer", "minimum": 0 },
    "rules": {
      "type": "object",
      "description": "ruleId -> reporting policy. An omitted rule is disabled. Maximum 2000 entries. Only ids present in the shipped diagnostic catalog are accepted.",
      "maxProperties": 2000,
      "additionalProperties": {
        "type": "object",
        "additionalProperties": false,
        "required": ["severity", "scope"],
        "properties": {
          "severity": { "enum": ["none", "info", "warning", "error"] },
          "scope": { "enum": ["all", "production"] }
        }
      }
    },
    "gate": {
      "type": "object",
      "additionalProperties": false,
      "required": ["minimumSeverity", "minimumConfidence"],
      "properties": {
        "minimumSeverity": { "enum": ["info", "warning", "error"] },
        "minimumConfidence": { "enum": ["unknown", "medium", "high"] }
      }
    }
  }
}
