{"schemaVersion":1,"id":"experimental/dotnet-code-quality","version":"0.1.0","title":"Experimental .NET code quality","description":"Opt-in async correctness and evaluated project-policy checks derived from the archived making-ai-write-high-quality-code-in-dotnet guidance. Experimental: review findings and exceptions before adopting the gate.","targetContext":"SDK-style C# repositories using a single target framework per project","authors":["repo-doctor maintainers"],"derivedFrom":[],"engineMajor":0,"rules":{"MA0032":{"severity":"info","scope":"all"},"MA0040":{"severity":"warning","scope":"all"},"MA0042":{"severity":"warning","scope":"all"},"MA0134":{"severity":"warning","scope":"all"},"MA0137":{"severity":"info","scope":"all"},"MA0147":{"severity":"warning","scope":"all"},"MA0155":{"severity":"warning","scope":"all"},"RD1001":{"severity":"warning","scope":"all"},"RD1002":{"severity":"warning","scope":"all"},"RD1003":{"severity":"info","scope":"all"},"RD1004":{"severity":"info","scope":"all"},"RD1005":{"severity":"info","scope":"all"}},"gate":{"minimumSeverity":"warning","minimumConfidence":"unknown"}}
